{
  "authorization_scope": "C01E02_M2_2_EXACT_SLOT_HANDOFF",
  "batch_id": "C01E02-M2-2-SYNTH-PARTIAL-BAD-ROOF",
  "contract_binding": {
    "build_id": "C01CDV1-M2-R2",
    "content_fingerprint": "00f20b087b384f40f2a3602c25d41220dbda7504562533e811b6986522963fd4",
    "contract_revision": 2,
    "save_schema": 2
  },
  "handoffs": [
    {
      "actions": [],
      "approval_state": "producer_exact_handoff",
      "atlas": {
        "frames": {}
      },
      "authorization_scope": "C01E02_M2_2_EXACT_SLOT_HANDOFF",
      "binding_kind": "static_image",
      "build_id": "C01CDV1-M2-R2",
      "content_fingerprint": "00f20b087b384f40f2a3602c25d41220dbda7504562533e811b6986522963fd4",
      "contract_revision": 2,
      "facings": [
        "none"
      ],
      "has_alpha": false,
      "lifecycle_status": "active",
      "media_parameters": {
        "codec": "png",
        "has_alpha": false,
        "height": 1350,
        "width": 2400
      },
      "native_size": [
        2400,
        1350
      ],
      "pivot": [
        0.5,
        0.5
      ],
      "producer_handoff_id": "C01E02-M2-2-SYNTH-01",
      "profile_id": "c01cdv1_e02_scroll_m2_r2",
      "resource_path": "res://tests/fixtures/candidate_asset_r2/m2_2/map-base.png",
      "runtime_allowed": true,
      "sha256": "b0f1f5c780225dc13cb0dc03f576f34649534fe19038c42f37d453df1b8efe92",
      "slot_id": "MAP_C01CDV1_R2_BASE",
      "stable_id": "MAP_C01CDV1_SCROLLING_STREET_R2_BASE",
      "subject_id": "c01cdv1_e02_scroll_m2_r2",
      "topology_sha256": "baefc17f22f1a7d8956133e73be3a4d0e1a62a369441d782701975fa6230f8d8",
      "usage": "rolling_map_base"
    },
    {
      "actions": [],
      "approval_state": "producer_exact_handoff",
      "atlas": {
        "frames": {}
      },
      "authorization_scope": "C01E02_M2_2_EXACT_SLOT_HANDOFF",
      "binding_kind": "static_image",
      "build_id": "C01CDV1-M2-R2",
      "content_fingerprint": "00f20b087b384f40f2a3602c25d41220dbda7504562533e811b6986522963fd4",
      "contract_revision": 2,
      "facings": [
        "none"
      ],
      "has_alpha": true,
      "lifecycle_status": "active",
      "media_parameters": {
        "codec": "png",
        "has_alpha": true,
        "height": 1350,
        "width": 2400
      },
      "native_size": [
        2400,
        1350
      ],
      "pivot": [
        0.5,
        0.5
      ],
      "producer_handoff_id": "C01E02-M2-2-SYNTH-02",
      "profile_id": "c01cdv1_e02_scroll_m2_r2",
      "resource_path": "res://tests/fixtures/candidate_asset_r2/m2_2/map-buildings.png",
      "runtime_allowed": true,
      "sha256": "f175254c2540f2e6d6dd687a9f556663f67333dc5772772a14d326dd88a3f85e",
      "slot_id": "MAP_C01CDV1_R2_BUILDINGS",
      "stable_id": "MAP_C01CDV1_SCROLLING_STREET_R2_BUILDINGS",
      "subject_id": "c01cdv1_e02_scroll_m2_r2",
      "topology_sha256": "baefc17f22f1a7d8956133e73be3a4d0e1a62a369441d782701975fa6230f8d8",
      "usage": "rolling_map_buildings"
    },
    {
      "actions": [],
      "approval_state": "producer_exact_handoff",
      "atlas": {
        "frames": {}
      },
      "authorization_scope": "C01E02_M2_2_EXACT_SLOT_HANDOFF",
      "binding_kind": "static_image",
      "build_id": "C01CDV1-M2-R2",
      "content_fingerprint": "00f20b087b384f40f2a3602c25d41220dbda7504562533e811b6986522963fd4",
      "contract_revision": 2,
      "facings": [
        "none"
      ],
      "has_alpha": true,
      "lifecycle_status": "active",
      "media_parameters": {
        "codec": "png",
        "has_alpha": true,
        "height": 1350,
        "width": 2400
      },
      "native_size": [
        2400,
        1350
      ],
      "pivot": [
        0.5,
        0.5
      ],
      "producer_handoff_id": "C01E02-M2-2-SYNTH-03",
      "profile_id": "c01cdv1_e02_scroll_m2_r2",
      "resource_path": "res://tests/fixtures/candidate_asset_r2/m2_2/map-roofs.png",
      "runtime_allowed": true,
      "sha256": "0000000000000000000000000000000000000000000000000000000000000000",
      "slot_id": "MAP_C01CDV1_R2_ROOFS",
      "stable_id": "MAP_C01CDV1_SCROLLING_STREET_R2_ROOFS",
      "subject_id": "c01cdv1_e02_scroll_m2_r2",
      "topology_sha256": "baefc17f22f1a7d8956133e73be3a4d0e1a62a369441d782701975fa6230f8d8",
      "usage": "rolling_map_roofs"
    },
    {
      "actions": [],
      "approval_state": "producer_exact_handoff",
      "atlas": {
        "frames": {}
      },
      "authorization_scope": "C01E02_M2_2_EXACT_SLOT_HANDOFF",
      "binding_kind": "static_image",
      "build_id": "C01CDV1-M2-R2",
      "content_fingerprint": "00f20b087b384f40f2a3602c25d41220dbda7504562533e811b6986522963fd4",
      "contract_revision": 2,
      "facings": [
        "none"
      ],
      "has_alpha": true,
      "lifecycle_status": "active",
      "media_parameters": {
        "codec": "png",
        "has_alpha": true,
        "height": 1350,
        "width": 2400
      },
      "native_size": [
        2400,
        1350
      ],
      "pivot": [
        0.5,
        0.5
      ],
      "producer_handoff_id": "C01E02-M2-2-SYNTH-04",
      "profile_id": "c01cdv1_e02_scroll_m2_r2",
      "resource_path": "res://tests/fixtures/candidate_asset_r2/m2_2/map-foreground.png",
      "runtime_allowed": true,
      "sha256": "233a4bee1bc6848823a8d1be1060cfa0d3224c3ccbbcd2eec999411d7a049cac",
      "slot_id": "MAP_C01CDV1_R2_FOREGROUND",
      "stable_id": "MAP_C01CDV1_SCROLLING_STREET_R2_FOREGROUND",
      "subject_id": "c01cdv1_e02_scroll_m2_r2",
      "topology_sha256": "baefc17f22f1a7d8956133e73be3a4d0e1a62a369441d782701975fa6230f8d8",
      "usage": "rolling_map_foreground"
    },
    {
      "actions": [],
      "approval_state": "producer_exact_handoff",
      "atlas": {
        "frames": {}
      },
      "authorization_scope": "C01E02_M2_2_EXACT_SLOT_HANDOFF",
      "binding_kind": "static_image",
      "build_id": "C01CDV1-M2-R2",
      "content_fingerprint": "00f20b087b384f40f2a3602c25d41220dbda7504562533e811b6986522963fd4",
      "contract_revision": 2,
      "facings": [
        "none"
      ],
      "has_alpha": true,
      "lifecycle_status": "active",
      "media_parameters": {
        "codec": "png",
        "has_alpha": true,
        "height": 1350,
        "width": 2400
      },
      "native_size": [
        2400,
        1350
      ],
      "pivot": [
        0.5,
        0.5
      ],
      "producer_handoff_id": "C01E02-M2-2-SYNTH-05",
      "profile_id": "c01cdv1_e02_scroll_m2_r2",
      "resource_path": "res://tests/fixtures/candidate_asset_r2/m2_2/map-occlusion-mask.png",
      "runtime_allowed": true,
      "sha256": "5d545534e4c47c4157b6000e4c0f38b6b7194632eeb5ff02b5ef43ad213a394f",
      "slot_id": "MAP_C01CDV1_R2_OCCLUSION_MASK",
      "stable_id": "MAP_C01CDV1_SCROLLING_STREET_R2_OCCLUSION_MASK",
      "subject_id": "c01cdv1_e02_scroll_m2_r2",
      "topology_sha256": "baefc17f22f1a7d8956133e73be3a4d0e1a62a369441d782701975fa6230f8d8",
      "usage": "rolling_map_occlusion_mask"
    },
    {
      "actions": [],
      "approval_state": "producer_exact_handoff",
      "atlas": {
        "frames": {}
      },
      "authorization_scope": "C01E02_M2_2_EXACT_SLOT_HANDOFF",
      "binding_kind": "sprite_sheet",
      "build_id": "C01CDV1-M2-R2",
      "content_fingerprint": "00f20b087b384f40f2a3602c25d41220dbda7504562533e811b6986522963fd4",
      "contract_revision": 2,
      "facings": [
        "none"
      ],
      "has_alpha": true,
      "lifecycle_status": "active",
      "media_parameters": {
        "codec": "png",
        "has_alpha": true,
        "height": 1350,
        "width": 2400
      },
      "native_size": [
        2400,
        1350
      ],
      "pivot": [
        0.5,
        0.5
      ],
      "producer_handoff_id": "C01E02-M2-2-SYNTH-06",
      "profile_id": "c01cdv1_e02_scroll_m2_r2",
      "resource_path": "res://tests/fixtures/candidate_asset_r2/m2_2/map-state-layers.png",
      "runtime_allowed": true,
      "sha256": "d8017155c88ee3002c50a607355c3b7a8ce1007b3b5377d8470e5461622ea96e",
      "slot_id": "MAP_C01CDV1_R2_STATE_LAYERS",
      "stable_id": "MAP_C01CDV1_SCROLLING_STREET_R2_STATE_LAYERS",
      "subject_id": "c01cdv1_e02_scroll_m2_r2",
      "topology_sha256": "baefc17f22f1a7d8956133e73be3a4d0e1a62a369441d782701975fa6230f8d8",
      "usage": "rolling_map_damage_state_layers"
    },
    {
      "actions": [
        "idle"
      ],
      "approval_state": "producer_exact_handoff",
      "atlas": {
        "frames": {
          "idle/east": [
            128,
            0,
            128,
            128
          ],
          "idle/north": [
            0,
            0,
            128,
            128
          ],
          "idle/south": [
            256,
            0,
            128,
            128
          ],
          "idle/west": [
            384,
            0,
            128,
            128
          ]
        }
      },
      "authorization_scope": "C01E02_M2_2_EXACT_SLOT_HANDOFF",
      "binding_kind": "sprite_sheet",
      "build_id": "C01CDV1-M2-R2",
      "content_fingerprint": "00f20b087b384f40f2a3602c25d41220dbda7504562533e811b6986522963fd4",
      "contract_revision": 2,
      "facings": [
        "north",
        "east",
        "south",
        "west"
      ],
      "has_alpha": true,
      "lifecycle_status": "active",
      "media_parameters": {
        "codec": "png",
        "has_alpha": true,
        "height": 128,
        "width": 512
      },
      "native_size": [
        512,
        128
      ],
      "pivot": [
        0.5,
        1.0
      ],
      "producer_handoff_id": "C01E02-M2-2-SYNTH-07",
      "profile_id": "c01cdv1_e02_scroll_m2_r2",
      "resource_path": "res://tests/fixtures/candidate_asset_r2/m2_2/mecha_c01cdv1_guardian_z.png",
      "runtime_allowed": true,
      "sha256": "2b256a85dc11b01802840dbc9f97ffa7c06e5eaac31d1faa7c828db1909bf737",
      "slot_id": "MECHA_C01CDV1_GUARDIAN_Z",
      "stable_id": "V353U001",